StartDate,EndDate,Status,Progress,Duration (in seconds),Finished,RecordedDate,ResponseId,DistributionChannel,UserLanguage,Q1.2,Q1.3_1,Q1.3_2,Q1.4,Q1.5,Q2.2_1,Q2.2_2,Q2.2_3,Q2.3_1,Q2.3_2,Q2.3_3,Q2.4_1,Q2.4_2,Q2.4_3,Q2.5_1,Q2.5_2,Q2.5_3,Q2.6_1,Q2.6_2,Q2.6_3,Q2.7,Q2.8,Q2.9,Q2.10,Q2.11,Q2.12,Q3.1,Q3.1_4_TEXT,Q3.2,Q3.2_4_TEXT,Q3.3,Q3.3_4_TEXT,Q3.4,Q3.4_4_TEXT,Q3.5,Q3.5_4_TEXT,Q3.6,Q3.6_3_TEXT,Q3.7,Q3.7_4_TEXT,Q3.8,Q3.8_3_TEXT,Q3.9,Q3.9_3_TEXT,Q3.10,Q3.11,Q3.12,Q3.13,Q3.14,Q4.1,Q4.1_4_TEXT,Q4.2,Q4.3,Q4.3_7_TEXT,Q4.4
Start Date,End Date,Response Type,Progress,Duration (in seconds),Finished,Recorded Date,Response ID,Distribution Channel,User Language,What is your rank in the Professor of Teaching Series,What was the start date of your Professor of Teaching (Security of Employment) appointment? - Quarter,What was the start date of your Professor of Teaching (Security of Employment) appointment? - Year,Optional: Which School is your primary appointment in?,Optional: Which department is your primary appointment in?,"How do you feel your workload is distributed across research, teaching, and service categories? - Research","How do you feel your workload is distributed across research, teaching, and service categories? - Teaching","How do you feel your workload is distributed across research, teaching, and service categories? - Service",What do you think your Department's expectation of your workload is? - Research,What do you think your Department's expectation of your workload is? - Teaching,What do you think your Department's expectation of your workload is? - Service,What do you think your School's expectation of your workload is? - Research,What do you think your School's expectation of your workload is? - Teaching,What do you think your School's expectation of your workload is? - Service,What do you think the Campus' expectation of your workload is? - Research,What do you think the Campus' expectation of your workload is? - Teaching,What do you think the Campus' expectation of your workload is? - Service,What do you think your workload distribution should be? - Research,What do you think your workload distribution should be? - Teaching,What do you think your workload distribution should be? - Service,"Optional: if you wish to add comments regarding the previous 5 questions, please do so here.",How many courses do you typically teach in a typical academic year?,How many courses do you think you should teach in a typical academic year?,How many courses do the Research Rank Professors in your department or academic unit teach in a typical year?,"Optional: if you wish to comment on the previous 3 questions, please do so here.","Adjust the slider to show to what degree you feel overburdened with 5 being an appropriate work load and 10 being severely overburdened. As a reminder, please consider this question for a typical year (i.e., not a pandemic-year).",Does your academic unit allow you to stack classes to allow a quarter without teaching? - Selected Choice,Does your academic unit allow you to stack classes to allow a quarter without teaching? - Other/Explanation - Text,Does your academic unit work with you to assign courses to minimize/optimize your course preparation? - Selected Choice,Does your academic unit work with you to assign courses to minimize/optimize your course preparation? - Other/Explanation - Text,Does your academic unit allow you to have significant choice in the courses and sections you teach to allow for pedagogy research? - Selected Choice,Does your academic unit allow you to have significant choice in the courses and sections you teach to allow for pedagogy research? - Other/Explanation - Text,"If you do discipline-specific research, do you feel that your academic unit values your contribution to the field? - Selected Choice","If you do discipline-specific research, do you feel that your academic unit values your contribution to the field? - Other/Explanation - Text","If you do pedagogy/educational research, do you feel that your academic unit values your contribution to the field? - Selected Choice","If you do pedagogy/educational research, do you feel that your academic unit values your contribution to the field? - Other/Explanation - Text",Do you feel that you have adequate time to complete research activities as required by the university? - Selected Choice,Do you feel that you have adequate time to complete research activities as required by the university? - Other/Explanation - Text,Do you feel your department allows/encourages you to take sabbatical for the quarter(s) you request? - Selected Choice,Do you feel your department allows/encourages you to take sabbatical for the quarter(s) you request? - Other/Explanation - Text,Do you feel your teaching is supported in the department? - Selected Choice,Do you feel your teaching is supported in the department? - Other/Explanation - Text,Do you feel your service is supported in the department? - Selected Choice,Do you feel your service is supported in the department? - Other/Explanation - Text,How well do you feel your position as a Professor of Teaching is valued in your department?,Do you agree that your department has a good understanding of the Professor of Teaching series?,Where do you feel you are making the biggest impact internally (within UCI)?,Where do you feel you are making the biggest impact externally (outside of UCI)?,"If the requisite IRB approvals are obtained, are you willing to allow your responses to these survey questions to be used in aggregate with other responses for research purposes?",Please indicate your gender identity. - Selected Choice,Please indicate your gender identity. - A Different Identity (Please Specify): - Text,Do you identify as either transgender or nonbinary?,Please indicate your ethnicity: (select all that apply) - Selected Choice,Please indicate your ethnicity: (select all that apply) - Other: (please specify) - Text,Do you have a disability or impairment?
"{""ImportId"":""startDate"",""timeZone"":""America/Los_Angeles""}","{""ImportId"":""endDate"",""timeZone"":""America/Los_Angeles""}","{""ImportId"":""status""}","{""ImportId"":""progress""}","{""ImportId"":""duration""}","{""ImportId"":""finished""}","{""ImportId"":""recordedDate"",""timeZone"":""America/Los_Angeles""}","{""ImportId"":""_recordId""}","{""ImportId"":""distributionChannel""}","{""ImportId"":""userLanguage""}","{""ImportId"":""QID1""}","{""ImportId"":""QID40_1""}","{""ImportId"":""QID40_2""}","{""ImportId"":""QID41""}","{""ImportId"":""QID3_TEXT""}","{""ImportId"":""QID4_1""}","{""ImportId"":""QID4_2""}","{""ImportId"":""QID4_3""}","{""ImportId"":""QID5_1""}","{""ImportId"":""QID5_2""}","{""ImportId"":""QID5_3""}","{""ImportId"":""QID6_1""}","{""ImportId"":""QID6_2""}","{""ImportId"":""QID6_3""}","{""ImportId"":""QID7_1""}","{""ImportId"":""QID7_2""}","{""ImportId"":""QID7_3""}","{""ImportId"":""QID44_1""}","{""ImportId"":""QID44_2""}","{""ImportId"":""QID44_3""}","{""ImportId"":""QID8_TEXT""}","{""ImportId"":""QID13_TEXT""}","{""ImportId"":""QID10_TEXT""}","{""ImportId"":""QID14_TEXT""}","{""ImportId"":""QID33_TEXT""}","{""ImportId"":""QID32""}","{""ImportId"":""QID15""}","{""ImportId"":""QID15_4_TEXT""}","{""ImportId"":""QID16""}","{""ImportId"":""QID16_4_TEXT""}","{""ImportId"":""QID17""}","{""ImportId"":""QID17_4_TEXT""}","{""ImportId"":""QID18""}","{""ImportId"":""QID18_4_TEXT""}","{""ImportId"":""QID19""}","{""ImportId"":""QID19_4_TEXT""}","{""ImportId"":""QID20""}","{""ImportId"":""QID20_3_TEXT""}","{""ImportId"":""QID21""}","{""ImportId"":""QID21_4_TEXT""}","{""ImportId"":""QID22""}","{""ImportId"":""QID22_3_TEXT""}","{""ImportId"":""QID23""}","{""ImportId"":""QID23_3_TEXT""}","{""ImportId"":""QID24""}","{""ImportId"":""QID25""}","{""ImportId"":""QID26_TEXT""}","{""ImportId"":""QID27_TEXT""}","{""ImportId"":""QID45""}","{""ImportId"":""QID28""}","{""ImportId"":""QID28_4_TEXT""}","{""ImportId"":""QID42""}","{""ImportId"":""QID31""}","{""ImportId"":""QID31_7_TEXT""}","{""ImportId"":""QID29""}"
2021-02-08 08:13:41,2021-02-08 08:23:35,0,100,594,1,2021-02-08 08:23:35,R_W1hwxEvf8MH29xL,email,EN,1,1,40,6,Mathematics,10,60,30,20,60,20,20,60,20,20,60,20,5,70,25,"It’s hard to measure what is meant by “research”. No one has given me a clear answer.  Does giving talks count?  Setting up academic programs via grants? Different people give different answers. ",7,5,3,"There is currently a movement in mathematics to reduce the research faculty’s teaching load from 4 to 3.  This reduction does not affect teaching professors, which is causing tension.  I predict a bigger schism between research and teaching faculty because of this inequity. ",10,4,"I think so but I’ve never tried it. ",1,,1,,2,,2,,"2,3","There is so much uncertainty about what the research expectations are for teaching faculty. ",3,,1,,1,,3,5,"With keeping the undergraduate education experience together.  Honestly, without teaching faculty, this would just fall apart in our department. ","In outreach and diversity. These two topics are considered jokes to research faculty, so we teaching faculty take on this extra work. ",1,2,,2,4,,2
2021-02-08 08:23:32,2021-02-08 08:27:05,0,100,212,1,2021-02-08 08:27:05,R_2EmzrKzAC14XAUS,email,EN,3,2,32,4,Molecular Biology and Biochemistry,40,40,20,10,80,10,15,70,15,15,70,15,40,40,20,,5,5,1.5,,5,1,,1,,1,,3,,2,,1,,2,,1,,1,,4,5,administrative responsibilities,pedagogical research,1,2,,2,2,,2
2021-02-08 08:10:25,2021-02-08 08:30:20,0,100,1195,1,2021-02-08 08:30:21,R_cTvNnFwMEQIBfxv,email,EN,3,2,15,1,Drama,8,66,26,0,73,27,0,100,0,24,45,31,9,72,19,"It is important to recognize that Lecturers with Security of Employment are overworked and will have difficulty taking the now provided sabbaticals to write and research.  Teaching 3+ courses per quarter that are required courses for undergraduates and serving on multiple committees that need attention, taking a year leave cannot happen because there is no funding provided for the department for class coverage.",11,9,6,"The department becomes dependent on the Teaching Professor to carry the major courses for undergrads, making it impossible for that faculty member to obtain a sabbatical to conduct research or write. 

FYI - Research Rank Professors teach 5 or 6 (to allowed as an answer above).",7,2,,2,,2,,1,,2,,2,,2,,1,,1,,3,2,With my students.,Through my students' careers in the field.,1,1,,2,6,,2
2021-02-08 08:38:22,2021-02-08 08:49:05,0,100,643,1,2021-02-08 08:49:05,R_3g1VKB5AVKC5Jfx,email,EN,1,1,40,13,"Electrical Engineering and Computer Science ",17,42,41,24,50,26,40,40,20,9,61,30,45,45,10,"Sometimes the expectations don't add up to 100%, the expectations/workload can be more than 100% with a lot of teaching load plus service and still some research activity is required. ",6,5,3,"The expectation from research does not align with the start up fund that we get. Hence, we spend a lot of time trying to look for fund to recruit students which is not comparable with the research faculty which starts with a big start up to support the research with half the teaching load. Since there is a requirement for research, I think there should be startup to support hiring PhD students as well as purchase the required equipment. ",8,3,,1,,4,"I choose the classes however, I don't do pedagogy research",1,,4,I don't do pedagogy research,2,,"1,4",The department allowed me to take the faculty relief for Covid19,1,,1,,5,5,"Teaching and collaboration with others ","Research publication ",1,1,,2,7,Middle Eastern,2
2021-02-08 08:26:42,2021-02-08 08:50:41,0,100,1439,1,2021-02-08 08:50:42,R_2aQURsltwIvTWSs,email,EN,2,4,34,4,Ecology and Evolutionary Biology,5,75,20,13,75,12,20,70,10,10,80,10,13,75,12,"Workload distribution doesn't fully capture expectations around research. My teaching load is 4 times higher than that for research faculty, but the expectations for research aren't 4 times lower.",6,5,1.5,"# of courses isn't a good indicator of workload. My 4-unit lab class with 300 students spread across 12 sections with multiple TAs isn't equivalent to someone teaching a 4-unit seminar to 15 students. ",8,4,It usually isn't feasible since many classes are only taught once a year,1,,2,,3,,1,,2,,4,"Yes, but likely for only 1 quarter. It would requiring hiring too many adjuncts for me to take more quarters off",1,,1,,1,2,Within my classes by embracing inclusive teaching strategies.,In academic societies raising awareness of evidence based teaching strategies for STEM education,1,1,,2,4,,2
2021-02-08 08:42:16,2021-02-08 09:02:05,0,100,1188,1,2021-02-08 09:02:06,R_1ozNfI2K6srhv4v,email,EN,3,,21,6,Chemistry,5,75,20,5,75,20,5,75,20,50,40,10,5,75,20,"Curriculum development should be classified as part of research and teaching.  Applying the research professor's descriptions of the 3 categories is detrimental to UCI's teaching mission.  ",7,7,2,,6,2,,"1,4",I teach the same courses every year.,2,,4,I don't do this type of research,1,,2,,4,"For me to take a sabbatical, a significant shift in department resources would need to occur.  The position is over 35 years old and was not structured with the idea that a sabbatical would be taken by the individual.",1,,1,,2,2,"Educating students on fundamental lab skills, scientific thinking, and laboratory safety.   Educational technology use.",Electronic notebook use and lab safety.,1,5,,3,8,,3
2021-02-08 08:51:45,2021-02-08 09:06:31,0,100,885,1,2021-02-08 09:06:32,R_2SdZTqmFHZls24L,email,EN,1,1,40,7,ODT (an area - no depts at Merage),0,80,20,30,50,20,30,50,20,25,65,10,24,66,10,No idea what the campus expects;  No real idea of what my school expects either-first Merit is this year,7,7,4,"It is unclear.  My letter states 9 for my position with 1 release in years 1-3.  First year, I did 8.  This year (second year) I am doing 6 to arrive at an average of 7.  In addition to teaching and developing online courses, I am on 2 committees and I direct a IT group of 3 personnel. 

Not sure on the ""should"".  But I would like this to be clear and reflected in Merit/Tenure process.

I am concerned about the research/creative activities requirement in my school and how I will be judged.

There are very few LSOE at Merage and we are different.  Does it make sense to have the same criteria for all?",8,3,,4,Yes-to some extent,1,,3,,3,,2,,3,,1,,3,Not sure,2,3,Adding innovative classes and online/hybrid courses.  Helping to move information technology at Merage forward.,Not sure yet.,1,2,,2,6,,2
2021-02-08 09:09:28,2021-02-08 09:15:16,0,100,347,1,2021-02-08 09:15:17,R_31gyaMgd0JGTIrA,email,EN,3,4,27,,,15,70,15,10,70,20,10,70,20,5,80,15,15,70,15,,5,5,1.5,,9,1,,1,,3,,1,,1,,1,,1,,1,,1,,3,3,"Teaching, service",research,1,1,,2,6,,2
2021-02-08 09:15:46,2021-02-08 09:21:24,0,100,337,1,2021-02-08 09:21:24,R_28AHXNYn0xFpwbv,email,EN,2,1,35,9,"Health, Society, and Behavior",5,65,30,25,50,25,25,50,25,25,65,10,15,65,20,,6,6,3,,7,2,,2,,2,,1,,3,,2,,3,,1,,1,,3,2,Administrative service and mentorship of junior faculty/students.,Pedagogy in my field.,1,1,,2,6,,2
2021-02-08 08:15:27,2021-02-08 09:21:49,0,100,3981,1,2021-02-08 09:21:49,R_2lyqMQ8ApgGCdY5,email,EN,2,1,28,12,Psychological Science,0,75,25,10,70,20,12,75,13,20,55,25,0,75,25,"When I was hired in 2007, I was very explicitly told that I would not be evaluated on my research.  This was one of the primary reasons I accepted this position.  My passion is teaching (and, to a lesser extent, service), which is why I was attracted to this position.  Then, after working here for several years, I was told that the rules had changed, and I was now expected to do research.  However, my teaching load (or service load) was not reduced in light of these increased research expectations.  My teaching load is very heavy – not only are we required to teach 7 courses per year, but each of my courses has at least 200 (but usually more like 300 or 400) students enrolled – and at least in my department, the administration typically does not allow me to teach the same course more than once in an academic year – meaning that I am teaching seven DIFFERENT courses throughout the year.  The amount of lecture/course prep that goes into maintaining all of these different courses is considerable.  On top of that, because I teach so many students, I am constantly writing letters of recommendation for students, which is extremely time consuming.  For example, during the period of Sept 2020 through Jan 2021, I wrote letters of recommendation for over FOURTY different students, most of whom were applying to at least 8 different schools.  In my discipline, each school requires recommenders to fill out a different form for the student and upload a unique letter (unlike law schools or med schools, which use a centralized system), which means that over the last few months, I have written/submitted over 320 letters of recommendation. Similarly, because I teach so many students, I am often the first choice for students to ask me to speak to their student organizations – and for faculty to ask for my help with their student issues and/or planning their courses.  I realize that I could say no to these requests – but isn’t that exactly what my position is supposed to be about?  Engaging with students and helping faculty with their teaching concerns?  Given all this (and given that considerable service I am doing for my department, the school, and the university), I have virtually NO time AT ALL during the regular school year to conduct research.  The only time I have to conduct research is over the summer and during sabbatical – but even then, a lot of my summer (and even some of my sabbatical) is taken up by the (compensated) service that I do in my role as the program director for the revenue-generating post-bacc program in my department.  Also, although I appreciate the sabbatical, I would be happy to forgo sabbatical if it meant that I weren’t required to produce research. In fact, I have been so disheartened by this push for teaching professors to conduct research that I have seriously considered looking into the possibility of requesting that I be moved to a part-time position (as I have heard that faculty are allowed to switch to part-time, if they take an associated pay cut).  I know that the school expects me to spent 10-15% of my time on research – so, if I could take a 10-15% pay cut and NOT be expected to do any research (but maintain the same teaching load and service expectations), that would be ideal.  I am happy to give up some money and my sabbatical if it means I can go back to what I was hired to do, which is teach (and do service).  ",7,6,4,"Several years ago, shortly after Diane O'Dowd announced that teaching professors would be expected to conduct research, I attended a meeting (run by Diane O'Dowd) that all of the teaching professors were invited to.  During that meeting, Diane explicitly stated that research would be not be required for a merit review but that it WOULD be required for a promotion.  I took that information seriously and even informed everyone in my department that this was the expectation.  Several years later (in 2018), I had a 3-year merit review that went through CAP, for which my department chair and my dean both wrote that they would have supported an acceleration for me if such a thing existed for my position (which - at the time - it did not, given that we did not have steps yet).  Even though the chair and dean were talking about an acceleration in their letters, CAP was voting on a simple merit for me (seeing as we didn't have accelerations for my position at the time).  During this review period, I won multiple teaching awards (including a diversity-related award), I had outstanding service (including directing a successful, revenue-generating program), and I was a co-author (at 10% contribution) on a journal article in a very high impact journal.  Although I realize that a 10% contribution is one article is not very much, it was my understanding (based on that meeting held by Diane O'Dowd) that research was not required for a standard merit - only for a promotion.  So, in my mind, I was doing MORE than I was required to do with respect to research during that review period (seeing as I did more than nothing).  However, THREE members of CAP voted me for to get a ""no action"" for that review.  Ultimately, they were outvoted, and my merit was approved - but there seems to be a major disconnect when my chair and dean are arguing that I should get an acceleration while 3 members of CAP argue that I should get a no action on a standard merit.  The bottom line is that I can't do outstanding teaching and outstanding service (with my current teaching and service load) AND ALSO do high-quality (or even mediocre-quality) research.  Something has to give.  I realize that I could just put less effort into my teaching and/or into my service (such that I  could ""phone it in"" a bit more with my courses and/or I could say no to service more often) in order to make room for research - but that seems really, really wrong, given that I was hired for teaching and service, I am great at it, and I want to do it.  The university is filled with amazing research professors who have the time (and passion and talent) to conduct and produce outstanding, high-quality research.  Let them focus on what they are great at, and let me focus on what I am great it.  Who does it benefit for me to have to reduce the quality or quantity of my teaching and service in order to make room for me to conduct mediocre research?  Please just let us focus on what we were hired for, what we love to do, and what our students (and departments) need from us!",9,4,"I have never asked to do this, so I don't know - but I wouldn't even want to attempt it!  My  courses are very large, usually 300-400 students, so stacking my classes like that would result me in having more than 1,000 student in a quarter.  That is just not do-able.",2,,2,,1,,1,,2,,1,,1,,1,,2,2,In my courses and as the director of the psych science post-bacc program,"Through the professional facebook & instagram accounts that I manage.  I post lots of information and opportunities on there about jobs, grad school, psychology, etc. - and I know that a lot of alum (and even a fair number of people who are not associated with UCI) follow those pages.  (I have over 2,000 followers on my facebook page and over 400 followers on my instagram page).",1,1,,2,6,,2
2021-02-08 08:18:14,2021-02-08 09:22:22,0,100,3847,1,2021-02-08 09:22:23,R_1js4z3QevtMpLoW,email,EN,2,1,39,5,Computer Science,0,80,20,10,80,10,20,70,10,25,70,5,5,85,10,"These questions are hard to answer. In the same way a tenure-track faculty can have varying levels within the categories, the same should be applied to teaching faculty. If a faculty is excelling in their teaching, then less performance in research or service should be accepted (as long as they are doing some of each). If minimal effort/quality teaching level is accepted for research faculty who bring in large amounts of funding or is highly visible, then a minimal amount of research should also be acceptable for teaching faculty who are excelling in the courses that they are teaching or handling very large courses with strong teaching evals. ",6,5,3,"All courses should not be counted equally! 4 unit courses should not be counted in the same fashion as 6 unit courses - there is more content, more prep, and more support, or 2 unit courses (in the opposite fashion).  Additionally, a metric is needed for course size (possibly based on average course size in a discipline). The support overhead for a course of 400 is much higher than for a 200 person, which is higher than 20-50 and 100.  
",7,3,,4,Depends on the current course scheduler,2,,3,,2,,2,,4,Its not clear. No teaching faculty in the school has taken a sabbatical,3,Depends on the definition of  supported. The department allows for autonomous teaching of courses for all faculty.,2,,3,4,"Serving on Senate committee(s) and supporting campus teaching initiatives through participation in DTEI events, and bringing the knowledge back to the department faculty","Through the education and mentorship of students in my courses. ",1,1,,2,2,,2
2021-02-08 09:27:44,2021-02-08 09:47:57,0,100,1212,1,2021-02-08 09:47:57,R_3L6b1KOpo1Okae5,email,EN,1,4,36,6,,5,85,10,20,70,10,30,60,10,25,70,5,20,70,10,"During the quarter, research drops down to nearly 0%. Nearly all of my research is done during the summer months, when I am not being paid, because I am unable to apply for grants that would allow me to make up summer salary. ",7,6,2,"Workload is dependent on the number of unique courses taught, and the number of new courses that fall to the Professors of Teaching (majority of new courses are offloaded onto us). During a quarter where new courses are taught, research falls to nearly zero. This combined with the fact that we don't have time to apply for grants during the year to make up for our summer salaries means that we are effectively ""volunteering"" our time during the summer just to make up for research that doesn't get done during the school year, or we are forced to teach summer school classes to make up that portion of our salaries (in which case research remains near zero). While the department level is usually fairly understanding, these contributions will fall short during tenure or promotion to full professor reviews, because there is a lack of understanding at a campus (or external review) level of the different department-level expectations. ",8,2,,"2,4",It really depends on the academic year and the needs of the department,2,,3,,2,,2,,"3,4",I feel that it would be difficult to take a sabbatical due to the sheer number of courses taught and the strain this would put on the department,1,,1,,2,3,"Undergraduate teaching/advising. ",NA,1,1,,2,6,,2
