StartDate,EndDate,Status,Progress,Duration (in seconds),Finished,RecordedDate,ResponseId,DistributionChannel,UserLanguage,Q1.2,Q1.3_1,Q1.3_2,Q1.4,Q1.5,Q2.2_1,Q2.2_2,Q2.2_3,Q2.3_1,Q2.3_2,Q2.3_3,Q2.4_1,Q2.4_2,Q2.4_3,Q2.5_1,Q2.5_2,Q2.5_3,Q2.6_1,Q2.6_2,Q2.6_3,Q2.7,Q2.8,Q2.9,Q2.10,Q2.11,Q2.12,Q3.1,Q3.1_4_TEXT,Q3.2,Q3.2_4_TEXT,Q3.3,Q3.3_4_TEXT,Q3.4,Q3.4_4_TEXT,Q3.5,Q3.5_4_TEXT,Q3.6,Q3.6_3_TEXT,Q3.7,Q3.7_4_TEXT,Q3.8,Q3.8_3_TEXT,Q3.9,Q3.9_3_TEXT,Q3.10,Q3.11,Q3.12,Q3.13,Q3.14,Q4.1,Q4.1_4_TEXT,Q4.2,Q4.3,Q4.3_7_TEXT,Q4.4
2021-02-09 08:19:26,2021-02-09 09:41:26,0,100,4919,1,2021-02-09 09:41:26,R_3DnAQIsbPK20BJB,email,EN,2,1,38,2,,5,60,35,0,90,10,10,75,15,20,70,10,15,65,20,"The first question was difficult to answer. I answered it in relation to the average time I have spend on these things in the past three years. This year, however, I am spending at least 50% of my time on service (if not more). This is in part due to the pandemic, but also in large part not (the line is difficult to draw). 

Also, in my position, service is an important part of the teaching component because I work on pedagogical development. So, my service is directly related to teaching and is also necessary to create the infrastructure necessary for effective teaching in my program and in the School of Humanities. This kind of pedagogical work--which directly affects how teaching happens at the university--would ideally offset my other teaching responsibilities. It takes as much time--if not more. ",7,6,4,"I would ideally like to see different options for this position, that better define the nature of the work we do. For example: 
--a full teaching load of 6 courses and minimal service
 versus
--a partial teaching load of 4 courses and considerable service (for programmatic development, cross-campus initiatives, etc.)

",9,2,,2,,2,,3,,1,,2,,3,,1,,3,"to some extent, but not enough",2,4,Both in the classroom--directly with students--and with the work I am doing for pedagogical development across campus,"In mindfulness training, developing expertise in mindfulness and stress-reduction therapies.",1,1,,2,6,,1
2021-02-09 11:24:51,2021-02-09 11:41:52,0,100,1021,1,2021-02-09 11:41:53,R_3PuUmThWwxddZD5,email,EN,1,1,41,15,Economics,9,87,4,35,60,5,35,60,5,35,60,5,38,49,13,I do know how to answer those questions. It was never clear what school and campus expectations are,8,5,0,"I do not know the number of courses for a Research Rank professor. But I think that teaching 8 courses a year is too much and does not allow for good research. 
I do NOT know what the expectations of campus and school are for my workload!",8,3,,1,,"1,4",kind of ...we need to teach where it is necessary,"1,4","I also think that to be a good teacher one needs to do discipline research ",3,,2,,4,This does not apply yet,1,,1,,1,2,At the moment I do not know what to say because I just started July 2020 and my fall quarter was not an easy quarter,Presenting my research in conferences and working with other researchers,2,1,,2,6,,2
2021-02-09 12:12:24,2021-02-09 12:20:18,0,100,474,1,2021-02-09 12:20:19,R_1OqxNWhbMbaiovc,email,EN,1,1,40,10,,15,75,10,3,80,17,3,80,17,15,70,15,20,65,15,NA,6,6,3,,9,3,,1,,2,,1,,1,,2,,1,,1,,1,,3,4,"The undergraduate course experience - By providing high quality instruction and opportunities ",Through visibility - We are one of the premier institutions for Learning Analytics research.,1,2,,2,4,,2
2021-02-09 11:51:50,2021-02-09 12:24:07,0,100,1937,1,2021-02-09 12:24:07,R_2qgC3WW1s2uIvCG,email,EN,3,1,36,6,Chemistry,5,90,5,0,95,5,0,100,0,10,80,10,10,80,10,The pandemic has made it impossible to do anything but teach (about 60 hours per week on average is spent teaching),8,7,2,"Research can only be done by powering through in short bursts on top of a hectic teaching load. There is no time to have any life outside of work when I am writing a paper, for example, at the same time that  am teaching two classes.",8,2,,1,,1,,4,The teaching is valued. The research is overlooked unless it is time for a merit increase. Service is valued more than research.,3,,2,,4,"if I can cover my classes, then it would be allowed.",1,,1,,2,2,"My biggest impact is the job that I am doing teaching and mentoring students. I feel this every day, and it is incredibly rewarding. I am enormously proud of how I have risen to the occasion in this pandemic. My students are doing exceptionally well and the atmosphere that I have created is as close as you can get to an in-person class. I have mentored other faculty members teaching online for the first time in Fall 2020 and Winter 2021, and I know I have had an impact on them.","My publications and presence at conferences and talks that I have given have been impactful. In spring 2020, I published a manuscript detailing the steps that I took to move my class online virtually overnight, and I hope that this has been helpful to others who were teaching online for the first time in Fall 2020.",1,1,,2,6,,2
2021-02-09 12:51:59,2021-02-09 13:02:18,0,100,619,1,2021-02-09 13:02:18,R_rokrtfAWFdRy0mZ,email,EN,1,1,40,2,,10,70,20,25,50,25,30,50,20,30,50,20,10,60,30,It's hard to gauge this since only 2 of the 5 quarters I've taught so far have not been during the pandemic,6,6,3,,6,3,,1,,1,,3,,3,,2,,2,,1,,1,,2,2,I feel like my dedication to teaching is strengthening my department's offerings and could potentially increase the number of majors.,"Due to the pandemic, I feel I'm severely limited in my ability to have an impact outside of UCI.",1,1,,2,4,,2
2021-02-09 13:03:03,2021-02-09 13:10:11,0,100,427,1,2021-02-09 13:10:11,R_11j6kzZLtRVCUls,email,EN,1,2,39,13,Biomedical Engineering,5,70,25,30,60,10,30,60,10,30,60,10,30,60,10,,8,6,2,,9,3,,2,,2,,3,,1,,2,,2,,1,,1,,3,4,Within the undergraduate curriculum,Within engineering education for biomedical engineers,1,1,,2,6,,2
2021-02-09 12:20:17,2021-02-09 13:41:45,0,100,4888,1,2021-02-09 13:41:46,R_23UiIRrjuevxvpO,email,EN,1,3,39,9,"Health, Society, and Behavior",5,75,20,25,55,20,25,50,25,25,65,10,25,50,25,"It's very hard to gauge this and ignore the last year, as it's a third of my time as a teaching professor. My pandemic workload has been horrifying, and that matters, I think. ",6,6,3,"My normal teaching load and my departmental colleague's normal load are both very fair. ",5,3,,1,,4,"I haven't attempted to teach other things, but I think they'd be amendable.",1,,1,,2,,4,"The university has set it up so that I won't be able to take sabbatical for many years, but I assume the department will be fine.",1,,1,,1,1,"My two major classes are large and required are clearly affecting students in good ways, and this has made me feel like I am having a big impact on our undergraduates.","We are graduating hundreds of future public health workers every year, and I feel that this is producing a clear benefit to our community. It actually makes me feel like I'm doing something to counteract the horrors of our current horrors. ",1,2,,2,6,,2
2021-02-09 15:03:20,2021-02-09 15:09:48,0,100,387,1,2021-02-09 15:09:49,R_2aCXCFa6dZxEI9P,email,EN,1,4,38,13,EECS,10,60,30,20,60,20,20,60,20,20,60,20,10,80,10,The workload for teaching is underestimated (what 60/80% looks like at the school level vs what effort is needed to create a successful course for students).,6,6,3,"Number of courses do not tell the whole story. There is a huge difference if I am teaching a core course vs elective course, lower division vs upper division, graduate vs undergrad. There is also a huge difference between teaching a course and teaching it well.",8,1,,1,,1,,3,,1,,2,,3,,1,,1,,4,4,Core undergraduate courses,n/a - haven't had much time to attend conferences w/ the teaching & service load.,1,5,,3,8,,3
2021-02-09 19:05:50,2021-02-09 19:29:48,0,100,1438,1,2021-02-09 19:29:48,R_3qR1nNpNnR7SpN9,email,EN,1,1,39,1,Art,10,65,25,25,55,20,10,64,26,10,57,33,25,60,15,,8,7,3,"I'm responsible for 7 different courses. I don't mind teaching a load of 8 classes per year but the fact that I usually teach 6-7 distinct courses a year requires a lot of extra organizational energy and planning. ",7,3,,2,,4,"Ultimately I have the freedom to choose which courses to offer, however I am responsible for all of the beginning and intermediate level course so if I don't offer them then there is no one to teach them.",1,,3,,2,,1,,1,,2,,3,2,"with the students - teaching and mentorship, working with honors students",in my field of research and the work I produce,1,1,,2,7,Middle Eastern,2
2021-02-10 09:55:22,2021-02-10 10:50:42,0,100,3320,1,2021-02-10 10:50:42,R_33yiW577LWUmf9m,email,EN,1,4,37,7,,25,55,20,35,50,15,40,50,10,20,70,10,20,60,20,"I have many service appts (program director, senate committees, chair of large conference, area coordination, etc), which I enjoy and want to keep, however they do come at a cost of less time for research.",5,4,3,"Additional information for questions 1-3:
1. Typically 4-5 and 2, 2-unit internship courses which I don't get teaching credit for as they are considered part of my course release for my program director role.  Almost all of my classes are different and/or new preps.

2. 4 given all of my service work and I need time for research as there is high expectation still for research even with professor of teaching faculty.

3. 2-4
",8,2,,2,,2,,1,,2,,2,,1,,1,,3,there are expectations for service but I don't feel it's valued,4,4,"In curriculum development, running our masters program, and engagement with the professional community (conferences and student and diversity inclusiveness efforts). ",Engagement with the professional community (national conference and personal relationship building with business leaders locally and nationally. Student and diversity inclusiveness efforts- helping to build new student organizations and engage and enhance visibility to prospective and URM students regarding a career paths in my area of practice/research.  I also am active in discipline research and present at and attend conferences frequently.,1,1,,2,4,,2
2021-02-09 10:18:21,2021-02-10 14:54:28,0,100,102966,1,2021-02-10 14:54:28,R_2X0YlpBboLLVO6H,email,EN,3,,,,,25,70,5,15,70,15,20,70,10,20,70,10,25,65,10,,4,7,3,"Do you want to count my research lab as part of my teaching? We meet every other week for 5 hours and they enroll in a 198. ",6,3,,1,,1,,3,,3,,2,,2,,1,,1,,2,2,teaching and mentorship,research related to mentorship and work on URMs in HE,1,1,,2,8,,2
2021-02-10 13:31:53,2021-02-10 17:01:50,0,100,12597,1,2021-02-10 17:01:51,R_3NXrdDGKITE2Vbx,email,EN,3,,,8,,11,73,16,17,67,16,16,67,17,17,80,3,13,67,20,"1)This question misconstrues and risks misleading respondents regarding the three criteria under which PoT/SOE faculty are reviewed, and is therefore likely to lead to misleading or misinformed responses.  In particular, the relevant category is not ""Research,"" it is professional and/or scholarly achievement and activities, including creative activities. The offered definition is too narrow, and depending on the discipline may suggest to faculty that activities from this category are Service (or better, University and Public Service).  
Answering the amount of time that a faculty member would like to spend or her/his unit expects faculty to spend on ""Research"" may be constrained by support for such research, including the type of financial support provided to faculty in the Professor Series. See APM 210-3. 
 ",3,3,3,"I assume by ""Research Rank"" you are referring to faculty in the Professor Series.
By asking about the number of courses, the question fails to take into consideration the type of courses, the relative intensity or workload associated with those courses, and the credits associated with those courses.  To take a straight-forward example, a Clinical Law Professor may teach two semesters of clinic (12 credits, or high intensity focus on a small number of students) and a doctrinal class (3 or 4 credits), and a doctrinal Professor of Law may teach the same number of classes but more routinely in two doctrinal classes and a seminar (small number of students with a writing component that can vary in its intensity from significant to less so).  ",5,"2,4","I am not sure what stacking classes is, but we teach on a semester system in which all faculty are expected to teach in both semesters, absent a leave, sabattical or special agreement.","2,4",I Nor would I expect it to.,"1,2,4","two of our three classes are established by our disciplines and type of teaching.  We have significant choice in our third class.  Neither the course selection nor the sections are designed to allow for pedagogy research. ",4,"The Law School and faculty will appreciate and credit such ""research""; however, ""values,"" implicates questions regarding support for such research, and in general SOE faculty do not receive monetary support for discipline-specific research.",4,"The Law School and faculty will appreciate and credit such ""research""; however, ""values,"" implicates questions regarding support for such research, and in general SOE faculty do not receive monetary support for discipline-specific research",3,"Up to this point, under the criteria applied for merit to this point, yes.  Time is sufficient for the type of professional activites expected.  If scholarship and ""research"" expectations are increased, then time and support will need to increase.  ",1,,1,,1,,2,1,"Teaching and preparing students.  Service to the law school and the university.  ","Working with students on behalf of clients in order to defend and protect rights, health, communities, and the like.
Working with external colleagues to identify areas of critical need for client work, expanding, improving and developing pedagogies to better teach and prepare students, to better serve our clients, and to better make necessary interventions.   ",2,2,,2,6,,2
2021-02-10 18:15:47,2021-02-10 18:38:56,0,100,1388,1,2021-02-10 18:38:56,R_2PBtvY5SCAxTA1y,email,EN,1,1,40,5,Computer Science,25,70,5,15,70,15,15,70,15,10,85,5,30,60,10,,6,5,3,"I think the courses should be based more on how large one is.  For example, last quarter I had two courses, but they were in total 649 students.  I've had two classes in five quarters that are over 350 students each (not the same quarter).  I think that should ""count"" in some way towards the workload more.  I think for traditional TT faculty, it does (I am not entirely sure the system in place).",6,3,,1,,1,,3,,1,,1,,3,,1,,3,Working on it,2,1,"Between teaching several core classes and managing a group of undergraduate student researchers, I'm not sure.  One of those two!","I am on the board for a regional education conference.  I think that's the most so far of my impact.  I have a major study I am working on that I think will have impact, but I won't know how much of an impact for quite some time.",1,2,,2,6,,3
2021-02-11 12:17:40,2021-02-11 12:30:59,0,100,799,1,2021-02-11 12:31:03,R_3fUlqAGGyaW6nyN,email,EN,3,1,28,5,CS,0,85,15,15,70,15,15,70,15,20,65,15,0,85,15,"I really have no clue about everything other than what my workload is, and even that is not steady-state: it depends on what committees, etc. I'm on or chair.",6,6,0,"For 1: 6 on the books, 1 off, 3 more off that I teach teach; these other ""off"" classes are not graded, but meet weekly and have some bureaucratic work.

For 2: Without reaserach, I'm fine with 6. If required to do researach, less. The classes I teach are 200-300 students, and large staff. There is not much time to do much else than teach and administer these classes.

For 3: No idea, and the notion of ""courses"" is ill-defined (see above answer about class sizes).",5,3,,1,,1,,3,,3,,2,,2,,1,,1,,2,2,Students.,"As I reach my retirement, most of my external visibility is for work I did earlier in my career.",1,2,,2,6,,2
2021-02-11 12:49:16,2021-02-11 12:55:36,0,100,380,1,2021-02-11 12:55:37,R_yknuQRfngeqW2wp,email,EN,2,1,38,15,Global Studies,20,60,20,20,60,20,20,60,20,20,60,20,20,60,20,,6,6,4,,7,1,,1,,1,,1,,1,,2,,4,Hasn't come up yet,1,,1,,2,2,Curriculum development,Curriculum development,1,2,,2,6,,2
2021-02-09 08:53:26,2021-02-11 13:02:17,0,100,187731,1,2021-02-11 13:02:18,R_UiHVglqV0GQePYd,email,EN,3,1,29,1,Music,0,60,40,20,60,20,20,60,20,20,60,20,20,60,20,,6,5,5,,10,3,,3,,3,,1,,1,,2,,4,"sabbaticals are problematic for performance faculty in the arts who teach studio classes. Covering teaching requires hiring someone and there isn't the budget for that. Current faculty members assume an overload to allow a faculty member to take a sabbatical. ",1,,1,,3,3,In the areas of teaching and service,In teaching,1,1,,2,6,,2
2021-02-08 08:57:56,2021-02-11 13:35:53,0,100,275876,1,2021-02-11 13:35:53,R_PATbkcf2yeqXqet,email,EN,1,4,38,13,Civil and Environmental Engineering,20,55,25,30,60,10,45,50,5,45,50,5,10,60,30,"If you take into consideration the actual (or at least perceived) expectations of anyone's workload across campus the sums are easily over 100%. I feel the true opinion of MANY is 90% research 10% teaching and 0% service. The next person might say 80% research, 20% teaching... 
But looking at the average is somewhat meaningless in this case because it's not like there's a central decision maker about what faculty expectations are. Each person, be they a Chair or a Dean or a mentor to the faculty, view the role (any role) through their own lens. And you aren't affected by just one person or an average of opinions. Ultimately, both teaching and research become 90% each and service still falls off the radar, making the ""effective"" balance 90%,90%,0%.... if we're being honest with ourselves. 

Most faculty do not seem to grasp that Professors of Teaching are not going to be able to produce much research. With very limited resources (MUCH less than research faculty, who in my school have average startup funds of $700k, whereas I received $20k) and time to spend on these endeavours, even if they are related to teaching. It is simply unrealistic to expect more than a very small fraction of the ""productivity"" and impact with respect to traditional research metrics (e.g., journal papers, invited talks, etc)

Further, the type of research these folks (""we"") can, or should be expected to do, is also a misunderstood. Just because someone is in the Prof or Teaching role it does not mean they are going to be equipped, nor should they necessarily be equipped, to conduct ""teaching"" research or research on pedagogy.

You cannot simultaneously expect someone to be an expert in a field (i.e., the reason they are hired to teach university-level content, mentor students, and develop curricula in an area) to also be an expert in teaching/pedagogy theory... that is a separate field of science! That's not to say that some work can't be done, but there needs to be understanding about what we're talking about. 

Finally, much of Prof of Teaching work is INWARD focused and that also does not fit the mold well, especially the way CAP is constantly emphasizing external impact. For instance, curriculum development is a typical expectation from Prof of Teaching in many units/departments. This is very much an INWARD focused task. And further, it is very unrealistic to expect that a single Prof of Teaching will (1) have much impact in the first 5 years at UCI on the curriculum with their program, (2) much less that those changes will be somehow noticed and adopted by anyone outside UCI. For that matter, where does this fall? Service? Teaching? Research? All or none... depends on who you ask. But, regardless it's expected so how do we proceed? How do we make that case? And, if the campus wants us to be so outwardly focused, then why would we focus on this? It's a conflict.  

Apologies for such a long response... but things are much more complicated than just a division of work and/or expectations among three very generic ""buckets"".
",7,5,3,"My 7 total courses are 6 undergrad and 1 grad.  
I think 5 to 7 is appropriate depending on research expectations. 
In my unit research faculty are assigned 1 undergrad and 2 grad. This is an important distinction because grad courses are not nearly as demanding as those in undergraduate (generally). So for apples to apples comparison the typical faculty teaching load is more like 2 undergrad courses per year where mine is 6. This is a 3x not a 2x situation which is usually how discussions go with prof of teaching ""teaching load is 2x other faculty"" 

This balance is certainly depended upon research expectations.

It is also troublesome that the APM describes a process in which unproductive research faculty can be reassigned to LSOE (Professors of Teaching)... So, that implies that if someone ""isn't cutting it"" as a research faculty then they can take the lesser job of teaching faculty which has less research expectations. Yet, those hired into the teaching faculty roles are looked down upon if they aren't pumping out research (regardless if it's teaching related). 
 

",9,4,"It's not an explicit no, but effectively there are courses that I must teach each quarter in order to facilitate the graduation requirements of students within my program. So, effectively it's a NO.",4,"Again, it's effectively a NO, but not it's not that they ""do not work with me"". They are open to changes that are predicated by my developing the changes within the curriculum, myself, that would then change my workload each quarter. In other words, I can make changes to the curriculum that will optimize my course prep situation. But, it's not like that's going to happen very quickly. It takes several years after the degree requirements are changed before the new system can be taught.  ",4,"Again, not explicitly a NO, but effectively a NO. I mainly teach important elective courses that have only one section. So my ability to test out various teaching methods is pretty limited to ""try something this year... and then wait a whole year to try something else"".  So effectively no. ","1,4","I am saying YES but that reflects, of course, only a few colleagues that I know their opinions. ","3,4","I doubt it because what I've done so far is fairly specific to the electives I teach. In general, my contribution to my units' teaching is through assessment/accreditation and advocating for various teaching practices. Not through research per se.","2,3",I have basically no time to focus on any one thing for any appreciable amount of time. Teaching multiple courses each quarter cuts your schedule up too much in addition to committee meetings and other. I'm over extended all the time.,"3,4","I have not received tenure/SOE yet, so I don't know how the sabbatical situation is going to play out. I anticipate some pushback because I coordinate our senior capstone design program.",1,,"1,3",Although I am fairly certain most think I do too much service.,3,2,"I think that within my department and school, faculty are becoming more aware of our impact across the board. In my case, students are receptive and appreciative of my alternative messaging (i.e., more pragmatic approach to what I'm teaching and not ""just out of a textbook""), and other faculty are becoming aware of the value this has. So, I feel I'm making the biggest impact within my programs by injecting a more industry/practice-oriented focus on the senior capstone design sequence, which I hope is trickling down into the curriculum a bit. 

I'd also say that through my SERVICE within the department and school, that I am helping to enact positive changes to the curriculum. 

(but, as I mentioned before, this is not necessarily valued by all because it's not an outward-focused activity and it isn't research... so... in some respects I feel like I'm going to do all this work only to be told that I needed to do something else).
","Ah, see, I knew it was coming. Yes, external impact is important... but ultimately we also need to value what impacts people are having ON UCI. 

Externally, I'm producing some teaching tools that can/will be used by those in my field. I received a small grant to perform this work so there's some indication that someone thought it was going to be impactful. However, it's hard to say if other instructors will adopt the tools. Another issue with this, with respect to demonstrating my impact is... it's difficult to know if someone is using the tools or not. It's not like I'm going to get citations. ",1,5,,3,8,,3
2021-02-11 13:03:21,2021-02-11 13:37:58,0,100,2077,1,2021-02-11 13:37:59,R_3qrnAfhay7l4cIA,email,EN,2,1,36,1,Art,24,55,21,15,60,25,15,60,25,0,75,25,25,49,26,This survey is awful the interface does not allow for an adequate representation of my practice as a working artist. My first inclination was to close the window and not participate.,8,6,4,,7,2,,3,,3,,3,,3,,2,,1,,1,,1,,3,4,Creating continuity in the undergraduate photography classes. Through my teaching of undergraduates and mentoring of graduate teaching associates.,I don't understand the relevance of this question in relation to my duties in the art department. I could talk about my creative practice as an artist but I do not believe that is the expectation behind this question.,2,2,,2,6,,1
