StartDate,EndDate,Status,Progress,Duration (in seconds),Finished,RecordedDate,ResponseId,DistributionChannel,UserLanguage,Q1.2,Q1.3_1,Q1.3_2,Q1.4,Q1.5,Q2.2_1,Q2.2_2,Q2.2_3,Q2.3_1,Q2.3_2,Q2.3_3,Q2.4_1,Q2.4_2,Q2.4_3,Q2.5_1,Q2.5_2,Q2.5_3,Q2.6_1,Q2.6_2,Q2.6_3,Q2.7,Q2.8,Q2.9,Q2.10,Q2.11,Q2.12,Q3.1,Q3.1_4_TEXT,Q3.2,Q3.2_4_TEXT,Q3.3,Q3.3_4_TEXT,Q3.4,Q3.4_4_TEXT,Q3.5,Q3.5_4_TEXT,Q3.6,Q3.6_3_TEXT,Q3.7,Q3.7_4_TEXT,Q3.8,Q3.8_3_TEXT,Q3.9,Q3.9_3_TEXT,Q3.10,Q3.11,Q3.12,Q3.13,Q3.14,Q4.1,Q4.1_4_TEXT,Q4.2,Q4.3,Q4.3_7_TEXT,Q4.4
2021-02-08 09:30:05,2021-02-08 09:48:24,0,100,1098,1,2021-02-08 09:48:25,R_1IQNnfOPJ1YEZOM,email,EN,1,4,40,13,,10,75,15,25,55,20,20,55,25,20,60,20,20,60,20,,7,6,1,,7,2,,1,,2,,1,,2,,2,,3,,1,,1,,3,4,Teaching and mentoring undergraduate students in large classes and individual study.,Serving as a peer reviewer of publications.,1,2,,2,6,,2
2021-02-08 09:41:14,2021-02-08 10:10:10,0,100,1736,1,2021-02-08 10:10:11,R_2aWuPDewGz11VlK,email,EN,2,1,33,6,Earth System Science,5,80,15,10,80,10,20,70,10,20,70,10,5,80,15,"My department did not hire me for my research ability and therefore has much higher expectations of my teaching. We are usually the ones asked to design new classes. However it is hard to know whether we are being evaluated on ""research"" or ""professional activity"" and what falls under this category - the lines between teaching, research, and service are much more blurred and different people have different opinions!",7,6,2,The teaching load question varies a lot based on what classes are assigned. For example I teach 7 different classes each year whereas some teaching professors might teach the same class multiple times. In our department we are also usually the ones tasked with creating new classes which is a MUCH larger amount of work. There have only been 1 year in the 8 years of teaching when I have not been creating or teaching a new class (or redesigning to be online last year/this year). This dramatically reduces the amount of time I have available for professional activity and research given long-term service commitments and necessary service commitments for students e.g. writing letters of rec.,7,3,,2,,1,,3,,2,,2,,3,,1,,1,,1,3,"In the quality of the student experience - this could include teaching individual classes well, influencing the teaching of other (especially new) faculty, helping advocate for undergrads within faculty meetings and dept decision-making, helping redesign our majors, targeting service to undergrad related issues, being a faculty that our majors get to know well so that I can advise students and write reference letters, helping train our grad students in pedagogy to teach better but also so that they can succeed as future faculty.","This is much harder. I have ended up taking on a larger role than I initially expected as a Board member and now Vice-President of a local environmental non-profit. This was to network with local environmental professionals and to create greater education/research opportunities for our students but has taken over a bit more time than expected. I am also not clear if this is actually valued by the university? I provide my teaching materials to others when asked. Without greater partnerships with education researchers, I suspect that my service/teaching have a more significant impact than any research I can do which ends up being very specific to our specific major or classes which, unlike general chemistry/bio/physics/math, varies a lot from college to college for env science. Conference participation is hard when teaching, especially in classes without a TA during a brief 10-week quarter and I can rarely justify it.",1,1,,2,6,,2
2021-02-08 10:07:07,2021-02-08 10:13:49,0,100,402,1,2021-02-08 10:13:49,R_20OFUnhJCI0mP3a,email,EN,2,1,33,12,,5,90,5,10,80,10,10,80,10,10,80,10,30,60,10,,7,5,4,,10,2,,2,,2,,2,,2,,"2,3",Too many courses,2,,2,,2,,5,4,Campus-wide service,"I'm not, I'm just keeping my head above water given my course load.",1,1,,2,6,,1
2021-02-08 10:43:47,2021-02-08 11:07:15,0,100,1408,1,2021-02-08 11:07:16,R_2q31hfMdaDfOXKa,email,EN,2,1,35,3,Pharmaceutical Sciences,5,70,25,25,50,25,25,50,25,25,50,25,20,70,10,"Not sure about any but the first and last questions. I feel that my service commitment is too large (may be due to the new pharmacy school) and I would like to spend more time on research. Also, the numbers above are skewed due to your inclusion of research supervision of undergraduates under the Teaching component, rather than the Research component. ",6,6,1.5,,5,4,"My guess is yes, but I have never asked",4,"My guess is yes, but I have never asked",4,"I believe that I would be allowed to teach any class we offer. However, there is some expectation that certain classes would be taught by me.",1,,3,,1,,3,,1,,1,,1,2,"Being responsible for our undergraduate program. ","I believe that I have some recognition in my research field (aging). ",1,2,,2,6,,2
2021-02-08 11:17:00,2021-02-08 11:43:33,0,100,1593,1,2021-02-08 11:43:34,R_1mgQ2qs0RNMh9um,email,EN,1,1,39,5,Computer Science,10,70,20,5,80,15,5,80,15,15,70,15,15,70,15,"If this survey was asking about hours/week instead %, my teaching load will eat up most of the 40hr/week.",6,5,3,"I believe main problem is not the number of courses, but the teaching load. For that goal, we should consider number of course-units, students enrolled, undergrad/grad, lower/upper division and other possible factors that can determine the teaching workload.",9,1,,1,,1,,1,,1,,2,,1,,1,,1,,2,2,Service," discipline-specific research",1,2,,2,6,,2
2021-02-08 11:28:04,2021-02-08 11:52:12,0,100,1447,1,2021-02-08 11:52:12,R_1rwfdGWM0SnvtRA,email,EN,3,1,28,8,,2,95,3,0,90,10,0,90,10,34,33,33,5,90,5,"I answered this on the basis of what I understood to be the case BEFORE the ""professor of teaching"" happened. Even though my answer to ""what do I think the campus wants"" reflects my current understanding, I do  not agree with it, nor do I agree that this standard should be applied retroactively to those who came up for merit last year (as the ""old"" standard was supposed to apply through 2023. I do NOT agree with the unfair manner in which merits were denied last year on the basis of a new standard that was not made clear to the relevant faculty.",3,3,3,I also teach one or two one-on-one directed research seminars each semester. So do about half of the professors (research rank and SOE),5,4,We get sabbaticals in the same way that ladder faculty do,2,,2,,1,,3,,2,,1,,1,,1,,4,3,Teaching 1L students,"I don't have time to make an impact, because I never understood ""impact"" as being a requirement for external activities. I don't even know what ""impact"" means in this context.",1,1,,2,6,,2
2021-02-08 11:47:24,2021-02-08 11:57:01,0,100,576,1,2021-02-08 11:57:02,R_2tAm5KtgtPgNwyQ,email,EN,2,1,38,6,Chemistry,9,59,32,5,80,15,30,50,20,30,50,20,5,80,15,"I think that the university/CAP should be more open to allowing intensive pedagogy and service to reduce required research loads if the home department pushes for this. Its very difficult to make both department and university happy, which is required for successful promotions when they disagree. The campaign to force departments to align with University requirements seems to hurt the PoT rather than the departments and so there is very little incentive for the departments to change their expectations. ",6,6,2,"In order to achieve university level standards of research I should only be required to teach 4. However, my department and myself are happy with the 6 teaching load otherwise. ",6,1,,1,,1,,3,,2,,2,,4,"It is too new. Though they are trying, it is a task I am unsure that they are capable of. ",1,,1,,2,4,"Shifting attitudes toward more inclusive pedagogy practices (active learning, alternate grading options, ect....)","My time is largely focused inward. There is not enough time for outward focus. Though I suppose with my pedagogy research the answer would be the same. Shifting attitudes toward more inclusive pedagogy practices (active learning, alternate grading options, ect....)",1,1,,2,6,,2
2021-02-08 10:05:43,2021-02-08 12:01:00,0,100,6916,1,2021-02-08 12:01:00,R_2sXCzjShhWO83Q1,email,EN,2,1,33,4,Molecular biology and Biochemistry,10,70,20,20,70,10,20,70,10,20,70,10,20,60,20,,5,4,1.5,,8,2,,1,,1,,3,,2,,2,,1,,1,,1,,3,2,In campus-wide committees,External organizations,1,2,,2,7,South Asian,2
2021-02-08 09:52:24,2021-02-08 13:18:36,0,100,12372,1,2021-02-08 13:18:38,R_1dM7lrDQts4lrS4,email,EN,1,1,39,10,,5,90,5,10,80,10,10,80,10,15,70,15,20,71,9,"I am 4 months post mid career review and the criteria for tenure is, at best, evolving.  The above metrics are best guesses.",7,7,3,"One of the more salient issues around teaching during Covid-19 has been the availability of TA's to support teaching.  I am teaching loaded courses with 90 undergrads and one TA whose time allocation is 20 hours per week; in the Spring, I will be teaching 3 classes with a similar level of assistance. This directly impacts my ability to respond to student needs that since Covid have expanded to areas of wellness, such as: food and shelter insecurity, financial stress, sickness, and other assorted stressful life events.

Also, it's worth noting that I am 4 months post my mid career review and the criteria against which I'm being evaluated is ""evolving""  most senate faculty in my unit are, at best, vaguely aware of the criteria they're being asked to assess. 

Prior to being at UCI I was a Professor of the Practice (POP) at Duke as well as an Academic Dean; this model and many variations on this theme exist at many institutions, point being, UCI doesn't have to reinvent the wheel.

Finally, the questions ""what is the school's expectation of my academic workload"" is a moving target as far as distribution is concerned.",8,3,,2,,3,,3,,3,,2,,2,,2,,1,,4,5,"definently with the undergraduate students; many of them are first generation and do not arrive with the traditional skill set that I have experienced at other R1 universities. it's important to differentiate the curriculum and the  assessments that you deploy - Covid-19 has been very challenging for them across a myriad of contexts and I have worked to ensure that they feel heard, valued and provided with ample opportunities to demonstrate complete mastery of course material","Writing, presenting and researching in my area of American historical research centered on school choice and race.  Although during Covid this has proven challenging with archival research and the time to write being drastically curtailed",1,2,,2,6,,2
2021-02-08 13:28:22,2021-02-08 13:39:43,0,100,680,1,2021-02-08 13:39:43,R_6taozTMpjxPTw9H,email,EN,2,4,33,1,Drama,30,50,20,50,30,20,50,30,20,50,30,20,50,30,20,I think we work beyond 100% often. This should be evaluated.,12,8,6,"We urgently need some larger institutional support to balance the workload within our department. ",8,3,,1,,1,,1,,1,,1,,2,,1,,1,,2,1,My leadership and mentorship within my school.,My research is unique and benefiting the field on multiple levels.,1,2,,2,6,,2
2021-02-08 14:27:22,2021-02-08 14:33:23,0,100,360,1,2021-02-08 14:33:23,R_tWePt8u29iKPiVj,email,EN,1,1,36,12,,10,60,30,15,70,15,15,70,15,20,70,10,20,60,20,,6,5,3,,6,4,"They would, but I teach too many large classes to stack easily",1,,3,,2,,3,,2,,3,,1,,1,,2,2,"I teach a lot of large courses and service courses, and I do quite a bit of service (particularly at the school and departmental level).",Not sure.,2,1,,2,6,,2
2021-02-08 14:40:36,2021-02-08 14:57:17,0,100,1001,1,2021-02-08 14:57:19,R_1JLy5nNKGfY68kM,email,EN,1,1,38,15,Anthropology,10,70,20,25,60,15,20,70,10,30,60,10,15,70,15,,8,7,3,,6,4,nearly impossible with an 8-9 course load,4,I have broad control over which of the 10 courses I have developed I will teach in any given year.,4,This is not coming from the unit but rather from how I design the course itself.,4,"I am the only person in my sub-discipline in the department. But I do feel that my colleagues recognize its value and the efforts to connect it to broader interdisciplinary concerns. ",3,,"2,3",But this has been largely disrupted by both pandemic and an inaccessible field-site for research (Middle East).,4,Will plan to take first sabbatical next year -- chair has been supportive.,1,,1,,2,2,"1) Providing a set of core courses that were previously unavailable at UCI
2) Service to the department, school, university through numerous committee memberships and leadership roles in the department and Academic Senate.",This has been more of a challenge given the first couple of years developing courses and the pandemic. I continue to publish but have largely been unable to maintain a sustained research program. This should change with an upcoming 2 quarter sabbatical next AY that should allow me to complete some projects and initiate others. One major issue is having no time to develop grant proposals for finding external funding to support those efforts.,1,2,,2,6,,2
2021-02-08 15:13:13,2021-02-08 15:22:15,0,100,541,1,2021-02-08 15:22:15,R_12MA0Rgk97DMBds,email,EN,2,1,33,2,,10,50,40,30,60,10,0,60,40,10,50,40,30,40,30,"My workload goes above 100% because I'm not allotted any time for research in my current workload breakdown. ",4,3,4,"I hold an administrative appointment that gives me releases from teaching and which also enhances both my research and service elements. ",8,1,,1,,4,not really a consideration,1,,1,,2,,1,,1,,1,,3,2,"As Director of a very large undergraduate unit, I know my work is vitally important to the educations of most UCI students...and I don't take it lightly. ","My administrative work here at UCI has led to me into systemwide discussions and administrative positions...currently, I am centrally involved in creating the new writing placement system for newly matriculated UCI freshpeople. We are looking to place around 4,000 students this year...it's both an exciting and daunting project!",2,2,,2,6,,2
2021-02-08 15:07:55,2021-02-08 15:25:25,0,100,1049,1,2021-02-08 15:25:26,R_2cjEovAqOmFgYD5,email,EN,1,2,39,13,Mechanical and Aerospace Engineering,35,50,15,25,65,10,25,65,10,40,50,10,25,65,10,"I think there is too much of an emphasis on research products, since faculty are familiar with reviewing research performance. I'd like for there to be more focus on teaching but evaluative teaching and inclusive excellence criteria need to be improved significantly. 

Mentoring undergraduates is not considered teaching in my department. ",6,5,3,"It's very awkward for a professor of teaching to request teaching releases, but many tasks that are teaching adjacent (research on teaching methods, ABET evaluation, etc.) don't count as teaching. It's tricky when your research is on teaching and education - people don't know how to differentiate. ",8,2,,2,,1,,3,,"1,4","Only some of my colleagues value what I am doing. However, I think it is telling that I cannot advise a PhD student in engineering education research for their dissertation work. ",1,,3,,1,,1,,3,4,"Teaching graduate students about evidence-based teaching methods. They are our future faculty and so it is essential for them to learn about inclusive and equitable teaching practices. ","Through my discipline based education research. ",1,1,,2,"3,6",,3
2021-02-08 15:16:41,2021-02-08 15:55:23,0,100,2322,1,2021-02-08 15:55:24,R_33dIzqswHG0bq5D,email,EN,2,1,34,8,Law,15,63,22,5,70,25,5,70,25,15,60,25,25,50,25,,3,3,3,"I teach a 6-credit clinic each semester, a 3-credit large lecture course, plus independent study and advanced clinic add-ons. The above questions ask about ""courses,"" and this is also how my school conceptualizes it (i.e., the 6-credit per semester clinic ""counts"" as 1 course, just as a 1- or 2-unit seminar counts as 1 course). Research Rank and Legal Writing faculty teach 8-10 credits per academic year, while Clinical Faculty teach 14-16.",8,2,,2,,1,,"2,4","Associate Deans and senior faculty often say that writing is not required for the SOE line and my publications do not ""count.""","2,4","Associate Deans and senior faculty often say writing is not required for the SOE line and that publications don't ""count.""",3,"Yes, as required by the university, but ""no"" as desired for general career advancement.",1,,1,,1,,3,2,"Substantial teaching, directing a litigation-focused clinic that represents community members and some UCI students, directing an interdisciplinary center, chairing committees, working through the summer while in a 9-month position","Directing a litigation-focused clinic that represents community members and some UCI students, directing an interdisciplinary center, producing publications that are recognized in my fields, giving multiple lectures in the community each month and presenting at academic conferences",2,1,,2,6,,2
2021-02-08 15:47:18,2021-02-08 15:59:31,0,100,733,1,2021-02-08 15:59:32,R_a32aVFiP37CMAeZ,email,EN,1,4,39,4,,11,66,23,21,62,17,15,65,20,0,80,20,15,65,20,,5,5,1.5,It would be helpful if departments didn't allow faculty to create and keep a small boutique course for their teaching load if enrollment is below 100. It doesn't serve the students who have specific need for the big courses.,6,4,"It is theoretically allowed, but a course might need to be taught a certain quarter and there is nobody else willing to teach my courses.",4,"It isn't minimized, but it was agreed upon at the start and hasn't changed, so it is fine.",4,"If I needed to split a class into two sections for research, they might be able to make it happen. But otherwise the courses I teach need to be taught when I teach them, and nobody else can teach my courses.",3,,1,,1,,4,"I haven't tried yet, but they could probably work it out.",1,,1,,1,1,"My teaching, occasionally within my department regarding evidence-based teaching",Conference organization and publications,1,1,,2,6,,2
2021-02-08 17:54:08,2021-02-08 18:00:28,0,100,379,1,2021-02-08 18:00:28,R_3PNQmRhgpQzLYJP,email,EN,1,3,36,6,,15,70,15,15,70,15,15,70,15,15,70,15,25,60,15,,5,4,3,"The load based only on number of courses is deceptive. I keep getting assigned new courses, and often the assignments have come with very little advance notice. Teaching the same five courses year after year is VERY different than teaching 5 courses with 2-3 new courses per year.",7,3,,4,Somewhat,1,,3,,4,"Some do, others do not",2,,3,,3,Somewhat,3,Somewhat,4,4,With students in my classes and in my department,In discipline-specific research and program design,2,5,,3,8,,3
2021-02-08 18:22:02,2021-02-08 18:49:57,0,100,1675,1,2021-02-08 18:49:58,R_vMQkRyjhPe30IRX,email,EN,3,3,39,1,,10,65,25,20,60,20,30,35,35,30,40,30,20,60,20,"My first 8 years at UCI, I taught an average of 19 classes an academic year. Drama 240 classes (which are studio classes) actually require much time and energy than a standard class.  A frequently mis-understood reality by upper administration.",9,6,6,Can there please be a study about what folks get paid in the Claire Trevor School of the Arts verse what salary structures look like in other areas outside the arts? Thank you.,9,2,,1,,2,,1,,1,,2,,3,,1,,1,,3,2,In inspiring students to achieve the greatest potential,"Creating the next generation of Theatre Makers that have a national and international impact. ",1,2,,2,6,,2
2021-02-08 21:01:30,2021-02-08 21:12:27,0,100,657,1,2021-02-08 21:12:28,R_2rABfL8aNRnKOQu,email,EN,3,4,32,6,Chemistry,4,81,15,0,90,10,10,70,20,20,60,20,10,75,15,,4,3,2,"It's difficult for me to answer this because I am both instructor and lab coordinator in one. For example, I typically handle over 1000 students per quarter with a TA group larger than many other people's classes.",7,"2,4",It's not possible because I run the lab program.,1,,1,,3,,1,,2,,4,We have not determined how this will work because there is no one who could easily replace me for teaching without me having to do extensive extra work to prepare them or assist while I was on sabbatical.,1,,1,,1,2,There are enough of us in my department that we have been able to have an impact on our colleagues.,I have finally been able to create a network with social media and have been able to interact more with others in similar positions to mine. We are sharing remote teaching strategies and resources. I am able to provide support and guidance to newer faculty.,1,1,,2,6,,2
2021-02-08 23:41:41,2021-02-08 23:56:06,0,100,864,1,2021-02-08 23:56:07,R_qx7jhvbR7ue9zEt,gl,EN,3,4,36,13,Mechanical and Aerospace Engineering,5,55,40,10,70,20,20,70,10,30,60,10,20,45,35,I really don't know the campus expectation for PoTs.,6,6,3,"It is hard to measure courses for me. I do a lot of work with projects and they are not necessarily considered courses. With that said, it is a lot of work to teach 2 regular classes, so I would have a hard time teaching 2 regular classes (=6) per quarter. ",9,"3,4","Never asked, so I'm not sure. Stacking would probably kill me. ","2,4","More inclined to give research rank faculty a break in this regard. ","3,4",Never asked.,2,,"1,4",Maybe 50% of the department would ...,2,,3,,1,,1,,3,3,Student projects.,"I don't think I am making an external impact at this time. ",1,2,,2,6,,2
2021-02-09 01:01:50,2021-02-09 01:07:18,0,100,328,1,2021-02-09 01:07:19,R_3kB9o0cqQNViH1q,email,EN,2,1,36,6,,5,50,45,10,45,45,10,45,45,20,40,40,25,40,35,,7,6,3.5,,9,2,,1,,1,,1,,2,,2,,1,,1,,1,,3,3,Support of individual students,Research,1,2,,2,6,,2
2021-02-09 01:35:16,2021-02-09 01:54:58,0,100,1182,1,2021-02-09 01:54:59,R_24kCAB7byQumJz6,email,EN,1,1,38,12,Urban Planning & Public Policy,0,75,25,25,50,25,25,50,25,25,50,25,25,50,25,,8,6,4,,10,2,,2,,2,,2,,3,,2,,"2,3",,2,,2,,5,5," Remote teaching and student outreach and engagement",Research and professional networking,1,1,,2,2,,2
2021-02-08 08:08:58,2021-02-09 08:17:41,0,100,86923,1,2021-02-09 08:17:42,R_SIV24CMqPEbmpu9,email,EN,2,1,39,3,Pharmaceutical Sciences,36,40,24,26,54,20,30,46,24,17,61,22,43,43,14,,6,4,1.5,,9,3,,3,,3,,1,,3,,1,,3,,1,,1,,4,4,My discipline Research and teaching,"Research ",1,1,,2,7,middle eastern,2
2021-02-09 08:02:49,2021-02-09 08:23:27,0,100,1238,1,2021-02-09 08:23:44,R_w7WOfehx4wiGVhv,email,EN,3,1,41,4,Mol Bio and Biochem,15,70,15,15,70,15,15,70,15,15,70,15,15,70,15,"I am still new to UCI, and have not been through the merit/promotion cycle so I may be way off base in my expectations",5,5,1,"I really think there should be more emphasis on the number of units taught in the AP-10 and surveys like this.  For example, the questions in this survey ask only about course number and it is a very different thing to teach a 2 unit course compared to an 8 unit course.  Most of my courses are 8 unit courses.  I answered the thermometer question on this survey with the assumption being severely overburdened with 10 8 unit courses in a year.",10,3,,1,,2,,1,,3,,1,,3,,1,,1,,3,3,In the graduate program that I teach in and direct.,Not sure,1,1,,2,6,,2
2021-02-09 09:00:45,2021-02-09 09:05:38,0,100,292,1,2021-02-09 09:05:46,R_6nwi5ktZrAmnRC1,email,EN,1,1,37,6,Chemistry,25,50,25,40,50,10,30,50,20,50,30,20,30,50,20,"I am happy with my workload and my department's expectations, but I think the campus/CAP places more emphasis on research than my department does.",5,5,2,My teaching load is fine. My department does a good job with that.,5,3,,1,,1,,1,,1,,2,,3,,1,,"1,3","I did, but then I got a poor mid-career review and the department encouraged me to back off on Senate service, which I did.",1,2,"Within my department, with the classes I teach.","My (infrequent) publications, I guess.",1,2,,2,6,,2
2021-02-08 12:35:41,2021-02-09 09:13:30,0,100,74268,1,2021-02-09 09:13:30,R_2Blpj9QIR4ewTqZ,email,EN,1,1,40,4,,80,10,10,60,30,10,60,30,10,60,30,10,60,30,10,"I have only experienced 2 non-pandemic quarters, so I am not really sure what a ""normal"" quarter looks like yet. ",5,5,2,,6,3,,1,,3,,3,,3,,2,,3,,1,,1,,4,3,connection with students,course development,1,1,,2,6,,3
2021-02-09 09:13:24,2021-02-09 09:27:48,0,100,863,1,2021-02-09 09:27:49,R_2b41ATkfe9xsRco,email,EN,2,3,33,4,Neuroiology & behavior,10,60,30,10,60,30,10,60,30,10,60,30,10,60,30,,10,8,2,,7,3,,1,,1,,1,,1,,1,,3,,1,,1,,1,2,In my courses and through the development of new undergraduate programs.,"Probably in outreach at the moment, overseeing a medical free clinic and other programs. I've always cared more about making a direct impact in the community around UCI as opposed to making a name for myself as some kind of education research specialist. In education research I mainly try to tailor projects that allow undergrads to get their names on a publication. It's more about what I can do for them as opposed to me at this point in my career. ",1,1,,2,6,,3
